{
  "_metadata": {
    "_schema_version": "1.0",
    "_data_version": "1.0",
    "_last_modified": "2026-01-14T21:37:36.975467",
    "_description": "Combat Lab test ship: Test_Attacker_Beam360_Low"
  },
  "name": "Test Attacker Beam360 Low",
  "color": [
    255,
    0,
    0
  ],
  "team_id": 1,
  "ship_class": "TestS_2L",
  "theme_id": "Federation",
  "movement_policy": "test_do_nothing",
  "targeting_policy": "standard",
  "layers": {
    "CORE": [
      {
        "id": "test_beam_low_acc_1dmg"
      }
    ],
    "ARMOR": []
  },
  "_test_notes": "Attacker with Low Accuracy (0.5) Beam - 1 Damage for accuracy testing. Mass = hull_test_s(400) + weapon(0) = 400. Zero-mass component architecture.",
  "expected_stats": {
    "max_hp": 120,
    "max_fuel": 0.0,
    "max_energy": 0.0,
    "max_ammo": 0.0,
    "max_speed": 0,
    "acceleration_rate": 0.0,
    "turn_speed": 0.0,
    "total_thrust": 0,
    "mass": 400.0,
    "armor_hp_pool": 0
  },
  "resources": {
    "fuel": 0.0,
    "energy": 0.0,
    "ammo": 0.0
  }
}
