{
  "_metadata": {
    "_schema_version": "1.0",
    "_data_version": "1.0",
    "_description": "Combat Lab test ship: Stationary target with 200 HP shield + 5/sec regen (no resource cost)"
  },
  "name": "Test Target Shield Regen 5 Free",
  "color": [
    0,
    0,
    255
  ],
  "team_id": 2,
  "ship_class": "TestS_2L",
  "theme_id": "Federation",
  "movement_policy": "test_do_nothing",
  "targeting_policy": "standard",
  "layers": {
    "CORE": [
      {
        "id": "test_armor_extreme_hp"
      },
      {
        "id": "test_shield_200"
      },
      {
        "id": "test_shield_regen_5_no_resource"
      }
    ],
    "ARMOR": []
  },
  "_test_notes": "Free 5/sec regen (same rate as test_shield_regen but no energy cost). For SHIELD-REGEN-004 variant.",
  "expected_stats": {
    "mass": 400.0,
    "max_shields": 200
  }
}
