{
  "_metadata": {
    "_schema_version": "1.0",
    "_data_version": "1.0",
    "_last_modified": "2026-01-31",
    "_description": "Combat Lab test ship: Rapid-fire beam with low energy for RESOURCE-005 depletion"
  },
  "name": "Test Attacker BeamRapid LowEnergy",
  "color": [
    255,
    128,
    0
  ],
  "team_id": 1,
  "ship_class": "TestS_2L",
  "theme_id": "Federation",
  "movement_policy": "test_do_nothing",
  "targeting_policy": "standard",
  "layers": {
    "CORE": [
      {
        "id": "test_beam_rapid_1dmg"
      },
      {
        "id": "test_storage_energy_small"
      }
    ],
    "ARMOR": []
  },
  "_test_notes": "Beam (1 energy/shot) + small battery (25 energy). Fires 25 times then stops (energy depleted).",
  "expected_stats": {
    "max_hp": 125,
    "max_fuel": 0.0,
    "max_energy": 25.0,
    "max_ammo": 0.0,
    "max_speed": 0,
    "acceleration_rate": 0.0,
    "turn_speed": 0.0,
    "total_thrust": 0,
    "mass": 400.0,
    "armor_hp_pool": 0
  },
  "resources": {
    "fuel": 0.0,
    "energy": 25.0,
    "ammo": 0.0
  }
}
