{
  "_metadata": {
    "_schema_version": "1.0",
    "_data_version": "1.0",
    "_description": "Target with C&C bridge + shield requiring C&C"
  },
  "name": "Test Target Shield CNC",
  "color": [
    0,
    0,
    255
  ],
  "team_id": 2,
  "ship_class": "TestS_2L_CNC",
  "theme_id": "Federation",
  "movement_policy": "test_do_nothing",
  "targeting_policy": "standard",
  "layers": {
    "CORE": [
      {
        "id": "test_armor_extreme_hp"
      },
      {
        "id": "test_bridge_indestructible"
      },
      {
        "id": "test_shield_200_cnc"
      }
    ],
    "ARMOR": []
  },
  "_test_notes": "Bridge provides C&C, shield requires C&C. Shield should function.",
  "expected_stats": {
    "mass": 400.0
  }
}
