{
  "_metadata": {
    "_schema_version": "1.0",
    "_data_version": "1.0",
    "_last_modified": "2026-01-14T21:37:36.975467",
    "_description": "Combat Lab test ship: Test_Target"
  },
  "name": "Test Target",
  "ship_class": "TestL_4L",
  "theme_id": "Federation",
  "team_id": 0,
  "color": [
    0,
    0,
    255
  ],
  "movement_policy": "kite_max",
  "targeting_policy": "standard",
  "layers": {
    "CORE": [
      {
        "id": "test_bridge_basic"
      }
    ],
    "INNER": [],
    "OUTER": [],
    "ARMOR": [
      {
        "id": "test_armor_std"
      },
      {
        "id": "test_armor_std"
      },
      {
        "id": "test_armor_std"
      },
      {
        "id": "test_armor_std"
      },
      {
        "id": "test_armor_std"
      }
    ]
  },
  "_test_notes": "Standard test target. Mass = hull_test_l(4000) + bridge(0) + 5*armor(0) = 4000. Zero-mass component architecture.",
  "resources": {
    "fuel": 0.0,
    "energy": 0.0,
    "ammo": 0.0
  },
  "expected_stats": {
    "max_hp": 3050,
    "max_fuel": 0.0,
    "max_energy": 0.0,
    "max_ammo": 0.0,
    "max_speed": 0,
    "acceleration_rate": 0.0,
    "turn_speed": 0.0,
    "total_thrust": 0,
    "mass": 4000.0,
    "armor_hp_pool": 1000
  }
}
