{
  "_metadata": {
    "_schema_version": "1.0",
    "_data_version": "1.0",
    "_description": "Combat Lab test ship: No armor, 1B HP hull structure in CORE only"
  },
  "name": "Test Target NoArmor Hull",
  "color": [
    0,
    0,
    255
  ],
  "team_id": 2,
  "ship_class": "TestS_2L",
  "theme_id": "Federation",
  "movement_policy": "test_do_nothing",
  "targeting_policy": "standard",
  "layers": {
    "CORE": [
      {
        "id": "test_hull_extreme_hp"
      }
    ],
    "ARMOR": []
  },
  "_test_notes": "No armor layer components. All damage goes directly to CORE hull. Baseline for ARMOR-LAYER-001/002.",
  "expected_stats": {
    "mass": 400.0
  }
}
