{
  "_metadata": {
    "_schema_version": "1.0",
    "_data_version": "1.0",
    "_description": "Combat Lab test ship: Test Attacker Seeker Dmg50"
  },
  "name": "Test Attacker Seeker Dmg50",
  "color": [
    255,
    0,
    0
  ],
  "team_id": 1,
  "ship_class": "TestS_2L",
  "theme_id": "Federation",
  "movement_policy": "test_do_nothing",
  "targeting_policy": "standard",
  "layers": {
    "CORE": [
      {
        "id": "test_seeker_dmg_50"
      }
    ],
    "ARMOR": []
  },
  "_test_notes": "50 damage seeker",
  "expected_stats": {
    "mass": 400.0
  }
}
