{
  "_metadata": {
    "_schema_version": "1.0",
    "_data_version": "1.0",
    "_last_modified": "2026-01-31",
    "_description": "Combat Lab test ship: Rapid-fire projectile with high ammo for RESOURCE-006"
  },
  "name": "Test Attacker ProjRapid HighAmmo",
  "color": [
    200,
    200,
    0
  ],
  "team_id": 1,
  "ship_class": "TestS_2L",
  "theme_id": "Federation",
  "movement_policy": "test_do_nothing",
  "targeting_policy": "standard",
  "layers": {
    "CORE": [
      {
        "id": "test_proj_rapid"
      },
      {
        "id": "test_storage_ammo_100k"
      }
    ],
    "ARMOR": []
  },
  "_test_notes": "Projectile (1 ammo/shot, 0 reload) + ammo mag (100,000). Fires 100 times in 100 ticks, consuming 100 ammo with 99,900 remaining.",
  "expected_stats": {
    "max_hp": 160,
    "max_fuel": 0.0,
    "max_energy": 0.0,
    "max_ammo": 100000.0,
    "max_speed": 0,
    "acceleration_rate": 0.0,
    "turn_speed": 0.0,
    "total_thrust": 0,
    "mass": 400.0,
    "armor_hp_pool": 0
  },
  "resources": {
    "fuel": 0.0,
    "energy": 0.0,
    "ammo": 100000.0
  }
}
