{
  "_metadata": {
    "_schema_version": "1.0",
    "_data_version": "1.0",
    "_last_modified": "2026-01-17T12:00:00.000000",
    "_description": "Combat Lab test ship: Thruster only, no engine. Can rotate but cannot translate."
  },
  "name": "Test Thruster Only",
  "color": [
    255,
    128,
    0
  ],
  "team_id": 0,
  "ship_class": "TestS_2L",
  "theme_id": "Federation",
  "movement_policy": "test_do_nothing",
  "targeting_policy": "standard",
  "layers": {
    "CORE": [
      {
        "id": "test_thruster_std"
      }
    ],
    "ARMOR": []
  },
  "_test_notes": "Thruster only: No engine, 1 thruster. Mass = hull_test_s(400) + thruster(0) = 400. Can rotate but cannot translate. Zero-mass component architecture.",
  "expected_stats": {
    "max_hp": 120,
    "max_fuel": 0.0,
    "max_energy": 0.0,
    "max_ammo": 0.0,
    "max_speed": 0.0,
    "acceleration_rate": 0.0,
    "turn_speed": 15.625,
    "total_thrust": 0.0,
    "mass": 400.0,
    "armor_hp_pool": 0
  },
  "propulsion_details": {
    "engine_component": null,
    "engine_thrust": 0,
    "thruster_component": "test_thruster_std",
    "raw_turn_speed": 5.0,
    "total_mass": 400,
    "formulas": {
      "max_speed": "No engine - max_speed = 0",
      "acceleration": "No engine - acceleration = 0",
      "turn_speed": "turn_speed = (raw_turn * K_TURN) / mass^1.5 = (5.0 * 25000) / 400^1.5 = 15.625"
    }
  },
  "resources": {
    "fuel": 0.0,
    "energy": 0.0,
    "ammo": 0.0
  }
}
