{
  "_metadata": {
    "_schema_version": "1.0",
    "_data_version": "1.0",
    "_last_modified": "2026-01-14T21:37:36.975467",
    "_description": "Combat Lab test ship: Test_Engine_1x_MedMass"
  },
  "name": "Test Engine 1x MedMass",
  "color": [
    0,
    255,
    0
  ],
  "team_id": 0,
  "ship_class": "TestM_2L",
  "theme_id": "Federation",
  "movement_policy": "test_do_nothing",
  "targeting_policy": "standard",
  "layers": {
    "CORE": [
      {
        "id": "test_engine_no_fuel"
      },
      {
        "id": "test_mass_sim_1k"
      },
      {
        "id": "test_mass_sim_1k"
      }
    ],
    "ARMOR": []
  },
  "_test_notes": "1 engine + 2x mass simulators. Mass = hull_test_m(1000) + engine(0) + 2*1000 = 3000. Zero-mass component architecture.",
  "expected_stats": {
    "max_hp": 552,
    "max_fuel": 0.0,
    "max_energy": 0.0,
    "max_ammo": 0.0,
    "max_speed": 4.166666666666667,
    "acceleration_rate": 0.1388888888888889,
    "turn_speed": 0.0,
    "total_thrust": 500.0,
    "mass": 3000.0,
    "armor_hp_pool": 0
  },
  "propulsion_details": {
    "engine_component": "test_engine_no_fuel",
    "engine_thrust": 500,
    "total_mass": 3000,
    "formulas": {
      "max_speed": "max_speed = (thrust * K_SPEED) / mass = (500 * 25) / 3000 = 4.1667",
      "acceleration": "acceleration = (thrust * K_THRUST) / mass² = (500 * 2500) / 3000² = 0.1389"
    }
  },
  "resources": {
    "fuel": 0.0,
    "energy": 0.0,
    "ammo": 0.0
  }
}
